[
  {
    "id": "wm.focus",
    "module": "wm",
    "kind": "act",
    "title": "Focus a window",
    "summary": "Switch to a live client matched by class, title, or alias.",
    "aliases": [
      "switch to",
      "focus",
      "go to",
      "show me",
      "bring up"
    ],
    "slots": [
      {
        "id": "target",
        "label": "window",
        "required": true,
        "values": [
          {
            "id": "jellyfin",
            "label": "Jellyfin",
            "aliases": [
              "jellyfin",
              "the tv app",
              "movies",
              "the show"
            ]
          },
          {
            "id": "grokbot",
            "label": "Grok Bot",
            "aliases": [
              "grokbot",
              "grok bot",
              "the bot"
            ]
          },
          {
            "id": "firefox",
            "label": "Firefox",
            "aliases": [
              "firefox",
              "browser",
              "the other browser"
            ]
          },
          {
            "id": "kitty",
            "label": "Terminal",
            "aliases": [
              "terminal",
              "kitty",
              "shell"
            ]
          },
          {
            "id": "code",
            "label": "Editor",
            "aliases": [
              "editor",
              "code",
              "vscode"
            ]
          },
          {
            "id": "thunderbird",
            "label": "Mail app",
            "aliases": [
              "thunderbird",
              "mail app"
            ]
          }
        ]
      }
    ],
    "when": "A client whose class/title matches target is mapped.",
    "policy": "household",
    "walk": "hyprctl dispatch focuswindow address:<addr>",
    "examples": [
      "switch to jellyfin",
      "focus the terminal",
      "go to grokbot"
    ],
    "refuse": [
      "click the second tab",
      "the one on the left of the red one"
    ]
  },
  {
    "id": "wm.fullscreen",
    "module": "wm",
    "kind": "act",
    "title": "Fullscreen",
    "summary": "Fullscreen the focused or named client.",
    "aliases": [
      "fullscreen",
      "full screen",
      "make this bigger",
      "maximise",
      "maximize"
    ],
    "slots": [
      {
        "id": "target",
        "label": "window",
        "required": false,
        "values": [
          {
            "id": "active",
            "label": "this",
            "aliases": [
              "this",
              "that"
            ]
          },
          {
            "id": "jellyfin",
            "label": "Jellyfin",
            "aliases": [
              "jellyfin"
            ]
          },
          {
            "id": "grokbot",
            "label": "Grok Bot",
            "aliases": [
              "grokbot",
              "grok bot"
            ]
          }
        ]
      }
    ],
    "when": "Target client exists and is not already fullscreen.",
    "policy": "household",
    "walk": "focus if needed, then hyprctl dispatch fullscreen 1",
    "examples": [
      "fullscreen this",
      "switch to jellyfin and fullscreen"
    ],
    "refuse": [
      "make it look nicer"
    ]
  },
  {
    "id": "wm.workspace",
    "module": "wm",
    "kind": "act",
    "title": "Switch workspace",
    "summary": "Named or numbered workspace on the current monitor.",
    "aliases": [
      "workspace",
      "desk",
      "go to workspace"
    ],
    "slots": [
      {
        "id": "ws",
        "label": "workspace",
        "required": true,
        "values": [
          {
            "id": "1",
            "label": "one",
            "aliases": [
              "one",
              "1",
              "first"
            ]
          },
          {
            "id": "2",
            "label": "two",
            "aliases": [
              "two",
              "2"
            ]
          },
          {
            "id": "3",
            "label": "three",
            "aliases": [
              "three",
              "3"
            ]
          },
          {
            "id": "4",
            "label": "four",
            "aliases": [
              "four",
              "4"
            ]
          },
          {
            "id": "special",
            "label": "scratch",
            "aliases": [
              "scratch",
              "special",
              "hidden"
            ]
          }
        ]
      }
    ],
    "when": "Workspace id is in the live set or is creatable.",
    "policy": "household",
    "walk": "hyprctl dispatch workspace <ws>",
    "examples": [
      "workspace three",
      "go to two"
    ],
    "refuse": []
  },
  {
    "id": "wm.move_ws",
    "module": "wm",
    "kind": "act",
    "title": "Move window to workspace",
    "summary": "Move focused (or named) client silently, then optionally follow.",
    "aliases": [
      "put this on",
      "move this to",
      "send to workspace"
    ],
    "slots": [
      {
        "id": "ws",
        "label": "workspace",
        "required": true,
        "values": [
          {
            "id": "1",
            "label": "one",
            "aliases": [
              "one",
              "1"
            ]
          },
          {
            "id": "2",
            "label": "two",
            "aliases": [
              "two",
              "2"
            ]
          },
          {
            "id": "3",
            "label": "three",
            "aliases": [
              "three",
              "3"
            ]
          }
        ]
      }
    ],
    "when": "A focused client exists.",
    "policy": "household",
    "walk": "hyprctl dispatch movetoworkspace <ws>",
    "examples": [
      "put this on three"
    ],
    "refuse": []
  },
  {
    "id": "wm.close",
    "module": "wm",
    "kind": "act",
    "title": "Close window",
    "summary": "Close focused or named client. Named 'other browser' uses kill_other logic.",
    "aliases": [
      "close",
      "kill",
      "quit this window"
    ],
    "slots": [
      {
        "id": "target",
        "label": "window",
        "required": false,
        "values": [
          {
            "id": "active",
            "label": "this",
            "aliases": [
              "this"
            ]
          },
          {
            "id": "firefox",
            "label": "browser",
            "aliases": [
              "browser",
              "firefox",
              "the other browser"
            ]
          }
        ]
      }
    ],
    "when": "Target client exists.",
    "policy": "confirm",
    "walk": "hyprctl dispatch killactive or focus then kill",
    "examples": [
      "close this",
      "kill the other browser"
    ],
    "refuse": [
      "close everything"
    ]
  },
  {
    "id": "wm.float",
    "module": "wm",
    "kind": "act",
    "title": "Toggle floating",
    "summary": "Float or tile the focused window.",
    "aliases": [
      "float",
      "unfloat",
      "tile this"
    ],
    "slots": [],
    "when": "A focused client exists.",
    "policy": "household",
    "walk": "hyprctl dispatch togglefloating",
    "examples": [
      "float this"
    ],
    "refuse": []
  },
  {
    "id": "wm.monitor",
    "module": "wm",
    "kind": "act",
    "title": "Other monitor",
    "summary": "Move focus to the next monitor.",
    "aliases": [
      "other monitor",
      "other screen",
      "that display"
    ],
    "slots": [],
    "when": "More than one monitor is connected.",
    "policy": "household",
    "walk": "hyprctl dispatch focusmonitor +1",
    "examples": [
      "other monitor"
    ],
    "refuse": []
  },
  {
    "id": "wm.split_beside",
    "module": "wm",
    "kind": "act",
    "title": "Open beside",
    "summary": "Launch an allowlisted app in a split next to the focused window.",
    "aliases": [
      "beside",
      "next to",
      "split with"
    ],
    "slots": [
      {
        "id": "app",
        "label": "app",
        "required": true,
        "values": [
          {
            "id": "kitty",
            "label": "terminal",
            "aliases": [
              "terminal",
              "kitty"
            ]
          },
          {
            "id": "firefox",
            "label": "browser",
            "aliases": [
              "browser",
              "firefox"
            ]
          }
        ]
      }
    ],
    "when": "App is allowlisted.",
    "policy": "household",
    "walk": "hyprctl dispatch exec [tile] <bin>",
    "examples": [
      "open a terminal beside the editor"
    ],
    "refuse": []
  },
  {
    "id": "wm.ask_focused",
    "module": "wm",
    "kind": "ask",
    "title": "What is focused",
    "summary": "Return class/title/workspace of the active window.",
    "aliases": [
      "what's focused",
      "what is focused",
      "what am i looking at"
    ],
    "slots": [],
    "when": "Always when Hyprland is up.",
    "policy": "household",
    "askShape": "{ class, title, workspace, fullscreen }",
    "examples": [
      "what's focused"
    ],
    "refuse": []
  },
  {
    "id": "wm.ask_where",
    "module": "wm",
    "kind": "ask",
    "title": "Where is an app",
    "summary": "Workspace of a named class.",
    "aliases": [
      "which workspace",
      "where is"
    ],
    "slots": [
      {
        "id": "target",
        "label": "window",
        "required": true,
        "values": [
          {
            "id": "firefox",
            "label": "Firefox",
            "aliases": [
              "firefox",
              "browser"
            ]
          },
          {
            "id": "jellyfin",
            "label": "Jellyfin",
            "aliases": [
              "jellyfin"
            ]
          },
          {
            "id": "grokbot",
            "label": "Grok Bot",
            "aliases": [
              "grokbot",
              "grok bot"
            ]
          }
        ]
      }
    ],
    "when": "Target client exists.",